{
  "$schema": "https://json-schema.org/draft/2020-12/schema",
  "$id": "https://example.org/schemas/workflow_template.json",
  "title": "Workflow Template",
  "type": "object",
  "additionalProperties": false,
  "properties": {
    "id": { "type": "string" },
    "name": { "type": "string" },
    "description": { "type": "string" },
    "steps": {
      "type": "array",
      "items": {
        "type": "object",
        "additionalProperties": false,
        "properties": {
          "id": { "type": "string" },
          "name": { "type": "string" },
          "action": { "type": "string" }
        },
        "required": ["id", "name", "action"]
      }
    }
  },
  "required": ["id", "name", "steps"]
}
