{
  "id": "tmpl.enhanced.dashboard",
  "name": "Enhanced Dashboard Workflow",
  "description": "Build and deploy enhanced VS Code cockpit with real-time updates.",
  "steps": [
    { "id": "s1", "name": "Scaffold", "action": "generate" },
    { "id": "s2", "name": "Validate Schemas", "action": "validate" },
    { "id": "s3", "name": "Run Tests", "action": "test" }
  ]
}
